{
  "schemaVersion": 1,
  "captureId": "cap-33333333-3333-7333-8333-333333333333",
  "legacySessionId": "s-33333333-3333-7333-8333-333333333333",
  "archiveId": "ar-33333333-3333-7333-8333-333333333333",
  "streamIds": [
    "stream-33333333-3333-7333-8333-333333333333"
  ],
  "startedAt": "2026-07-22T10:00:00Z",
  "endedAt": "2026-07-22T10:02:00Z",
  "status": "closed",
  "sessionKind": "process-mapping",
  "recorderActorId": "actor-33333333-3333-7333-8333-333333333333",
  "sourceIds": [
    "src-33000000-0000-7000-8000-000000000001",
    "src-33000000-0000-7000-8000-000000000002"
  ],
  "capturePolicy": {
    "policyVersion": "consent-v1",
    "consentedAt": "2026-07-22T10:00:00Z",
    "modalities": [],
    "excludedApplications": [],
    "businessDataCapture": false
  },
  "clock": {
    "wallClock": "system",
    "monotonicClock": "mach_continuous_time",
    "clockDomainId": "clock-fixture-03",
    "bootId": "boot-fixture-03",
    "timeZone": "Europe/Prague"
  },
  "captureCommit": {
    "commitId": "cmt-33333333-3333-7333-8333-333333333333",
    "captureId": "cap-33333333-3333-7333-8333-333333333333",
    "path": "sessions/s-33333333-3333-7333-8333-333333333333/commit.json",
    "digest": "569846deca67e6acf606245eb11096f1fd8ca8c218a79d9096846fb49ab3754e"
  },
  "quality": {
    "status": "complete",
    "reasons": []
  }
}
